{
  "name": "Dumbbell Floor Press",
  "force": "push",
  "level": "intermediate",
  "mechanic": "compound",
  "equipment": "dumbbell",
  "primaryMuscles": [
    "triceps"
  ],
  "secondaryMuscles": [
    "chest",
    "shoulders"
  ],
  "stabilizerMuscles": [],
  "instructions": [
    "Lay on the floor holding dumbbells in your hands. Your knees can be bent. Begin with the weights fully extended above you.",
    "Lower the weights until your upper arm comes in contact with the floor. You can tuck your elbows to emphasize triceps size and strength, or to focus on your chest angle your arms to the side.",
    "Pause at the bottom, and then bring the weight together at the top by extending through the elbows."
  ],
  "category": "powerlifting",
  "images": [
    "Dumbbell_Floor_Press/0.jpg",
    "Dumbbell_Floor_Press/1.jpg"
  ],
  "id": "Dumbbell_Floor_Press"
}
