{
  "name": "Split Jerk",
  "force": "push",
  "level": "intermediate",
  "mechanic": "compound",
  "equipment": "barbell",
  "primaryMuscles": [
    "quadriceps"
  ],
  "secondaryMuscles": [
    "glutes",
    "hamstrings",
    "shoulders",
    "triceps"
  ],
  "stabilizerMuscles": [],
  "instructions": [
    "Standing with the weight racked on the front of the shoulders, begin with the dip. With your feet directly under your hips, flex the knees without moving the hips backward.",
    "Go down only slightly, and reverse direction as powerfully as possible. Drive through the heels create as much speed and force as possible, and be sure to move your head out of the way as the bar leaves the shoulders. At this moment as the feet leave the floor, the feet must be placed into the receiving position as quickly as possible.",
    "In the brief moment the feet are not actively driving against the platform, the athlete's effort to push the bar up will drive them down. The feet should be moved to a split stance, one foot forward, one foot back, with the knees partially bent. Receive the bar with the arms locked out overhead.",
    "Return to a standing position, bringing the feet together."
  ],
  "category": "olympic weightlifting",
  "images": [
    "Split_Jerk/0.jpg",
    "Split_Jerk/1.jpg"
  ],
  "id": "Split_Jerk"
}
