{
  "name": "Kettlebell Seated Press",
  "force": "push",
  "level": "intermediate",
  "mechanic": "compound",
  "equipment": "kettlebells",
  "primaryMuscles": [
    "shoulders"
  ],
  "secondaryMuscles": [
    "triceps"
  ],
  "stabilizerMuscles": [],
  "instructions": [
    "Sit on the floor and spread your legs out comfortably.",
    "Clean one kettlebell to your shoulder.",
    "Press the kettlebell up and out until it is locked out overhead. Return to the starting position."
  ],
  "category": "strength",
  "images": [
    "Kettlebell_Seated_Press/0.jpg",
    "Kettlebell_Seated_Press/1.jpg"
  ],
  "id": "Kettlebell_Seated_Press"
}
