{
  "name": "Barbell Rollout from Bench",
  "force": "pull",
  "level": "intermediate",
  "mechanic": "compound",
  "equipment": "barbell",
  "primaryMuscles": [
    "abdominals"
  ],
  "secondaryMuscles": [
    "glutes",
    "hamstrings",
    "lats",
    "shoulders"
  ],
  "stabilizerMuscles": [],
  "instructions": [
    "Place a loaded barbell on the ground, near the end of a bench. Kneel with both legs on the bench, and take a medium to narrow grip on the barbell. This will be your starting position.",
    "To begin, extend through the hips to slowly roll the bar forward. As you roll out, flex the shoulder to roll the bar above your head. Ensure that your arms remain extended throughout the movement.",
    "When the bar has been moved as far forward as possible, return to the starting position."
  ],
  "category": "strength",
  "images": [
    "Barbell_Rollout_from_Bench/0.jpg",
    "Barbell_Rollout_from_Bench/1.jpg"
  ],
  "id": "Barbell_Rollout_from_Bench"
}
