{
  "name": "Seated Palms-Down Barbell Wrist Curl",
  "force": "pull",
  "level": "beginner",
  "mechanic": "isolation",
  "equipment": "barbell",
  "primaryMuscles": [
    "forearms"
  ],
  "secondaryMuscles": [],
  "stabilizerMuscles": [],
  "instructions": [
    "Hold a barbell with both hands and your palms facing down; hands spaced about shoulder width.",
    "Place your feet flat on the floor, at a distance that is slightly wider than shoulder width apart.",
    "Lean forward and place your forearms on top of your upper thighs with your palms down. Tip: Make sure that the back of the wrists lay on top of your knees. This will be your starting position.",
    "Lower the bar as far as possible while inhaling and keeping a tight grip.",
    "Now curl bar up as high as possible while flexing the forearms and exhaling. Hold the contraction at the top for a second and Tip: Only the wrist should move."
  ],
  "category": "strength",
  "images": [
    "Seated_Palms-Down_Barbell_Wrist_Curl/0.jpg",
    "Seated_Palms-Down_Barbell_Wrist_Curl/1.jpg"
  ],
  "id": "Seated_Palms-Down_Barbell_Wrist_Curl"
}
