{
  "name": "Return Push from Stance",
  "force": "push",
  "level": "beginner",
  "mechanic": "compound",
  "equipment": "medicine ball",
  "primaryMuscles": [
    "shoulders"
  ],
  "secondaryMuscles": [
    "chest",
    "triceps"
  ],
  "stabilizerMuscles": [],
  "instructions": [
    "You will need a partner for this drill.",
    "Begin in an athletic 2 or 3 point stance.",
    "At the signal, move into a position to receive the pass from your partner.",
    "Catch the medicine ball with both hands and immediately throw it back to your partner.",
    "You can modify this drill by running different routes."
  ],
  "category": "plyometrics",
  "images": [
    "Return_Push_from_Stance/0.jpg",
    "Return_Push_from_Stance/1.jpg"
  ],
  "id": "Return_Push_from_Stance"
}
