{
  "name": "Barbell Shrug",
  "force": "pull",
  "level": "beginner",
  "mechanic": "isolation",
  "equipment": "barbell",
  "primaryMuscles": [
    "traps"
  ],
  "secondaryMuscles": [],
  "stabilizerMuscles": [],
  "instructions": [
    "Stand up straight with your feet at shoulder width as you hold a barbell with both hands in front of you using a pronated grip (palms facing the thighs). Tip: Your hands should be a little wider than shoulder width apart. You can use wrist wraps for this exercise for a better grip. This will be your starting position.",
    "Raise your shoulders up as far as you can go as you breathe out and hold the contraction for a second. Tip: Refrain from trying to lift the barbell by using your biceps.",
    "Slowly return to the starting position as you breathe in.",
    "Repeat for the recommended amount of repetitions."
  ],
  "category": "strength",
  "images": [
    "Barbell_Shrug/0.jpg",
    "Barbell_Shrug/1.jpg"
  ],
  "id": "Barbell_Shrug"
}
