{
  "name": "Lying Crossover",
  "force": "static",
  "level": "expert",
  "mechanic": null,
  "equipment": "body only",
  "primaryMuscles": [
    "abductors"
  ],
  "secondaryMuscles": [],
  "stabilizerMuscles": [],
  "instructions": [
    "Lie on your back with your legs extended.",
    "Cross one leg over your body with the knee bent, attempting to touch the knee to the ground. Your partner should kneel beside you, holding your shoulder down with one hand and controlling the crossed leg with the other. this will be your starting position.",
    "Attempt to raise the bent knee off of the ground as your partner prevents any actual movement.",
    "After 10-20 seconds, relax the leg as your partner gently presses the knee towards the floor. Repeat with the other side."
  ],
  "category": "stretching",
  "images": [
    "Lying_Crossover/0.jpg",
    "Lying_Crossover/1.jpg"
  ],
  "id": "Lying_Crossover",
  "isTimeBased": true
}
