{
  "name": "Tate Press",
  "force": "push",
  "level": "intermediate",
  "mechanic": "isolation",
  "equipment": "dumbbell",
  "primaryMuscles": [
    "triceps"
  ],
  "secondaryMuscles": [
    "chest",
    "shoulders"
  ],
  "stabilizerMuscles": [],
  "instructions": [
    "Lie down on a flat bench with a dumbbell in each hand on top of your thighs. The palms of your hand will be facing each other.",
    "By using your thighs to help you get the dumbbells up, clean the dumbbells one arm at a time so that you can hold them in front of you at shoulder width. Note: when holding the dumbbells in front of you, make sure your arms are wider than shoulder width apart from each other using a pronated (palms forward) grip. Allow your elbows to point out. This is your starting position.",
    "Keeping the upper arms stationary, slowly move the dumbbells in and down in a semi circular motion until they touch the upper chest while inhaling. Keep full control of the dumbbells at all times and do not move the upper arms nor rest the dumbbells on the chest.",
    "As you breathe out, move the dumbbells up using your triceps and the same semi-circular motion but in reverse. Attempt to keep the dumbbells together as they move up. Lock your arms in the contracted position, hold for a second and then start coming down again slowly again. Tip: It should take at least twice as long to go down than to come up.",
    "Repeat the movement for the prescribed amount of repetitions of your training program."
  ],
  "category": "strength",
  "images": [
    "Tate_Press/0.jpg",
    "Tate_Press/1.jpg"
  ],
  "id": "Tate_Press"
}
